{
    "mathematicalMethodsCategoryPaths": [
        "opt/diff/order1/sd",
        "linalg/ortho/gs"
    ],
    "modelCategoryPaths": [
        "pb/qm/*"
    ],
    "type": {
        "name": "RMM-DIIS eigensolver",
        "slug": "rmm-diis"
    },
    "parameters": {
        "blockSize": {
            "value": 4
        },
        "diis.maximumSteps": {
            "value": 6
        },
        "orthonormalization.nDimensions": {
            "value": 16
        },
        "convergence": {
            "value": 1e-3,
            "precision": true
        }
    }
}
